Opportunity_ID,Account_Name,Opportunity_Name,Current_Revenue,JH_Q4_Deal,Issue,Recommended_Action
006Wj00000MztAz,Coillte,Coillte - November RR Revenue,194837.52,19488 (PROW Extension),Run rate capture not new Q4 deal,Document as Run Rate Capture OR backdate to original contract
006Wj00000Mztan,Airship Group Inc,Airship - November RR Revenue,166527.79,None in JH,Existing recurring revenue no Q4 booking,Document as Run Rate Capture OR link to historical deal
006Wj00000Mzcjf,Creed McStay,Creed McStay - November RR Revenue,38804.44,None in JH,Existing recurring revenue,Document as Run Rate Capture
006Wj00000Mzcjg,Department of Children Disability and Equality,DCEDIY - November RR Revenue,37152.91,None in JH (historical $1.18M),Run rate from historical deal,Document as Run Rate Capture OR link to historical deal
006Wj00000Mzcje,Coleman Legal,Coleman Legal - November RR Revenue,16652.78,None in JH,Existing recurring revenue,Document as Run Rate Capture